category,product,slug,sku,description,image,available
Stickers,Stickers redondeados,stickers-redondeados,S1,Stickers redondeados de alta calidad,,True
Stickers,Stickers troquelados,stickers-troquelados,S2,Stickers troquelados de alta calidad,,True
Stickers,Stickers semitroquelados,stickers-semitroquelados,S3,Stickers semitroquelados de alta calidad,,True
Stickers,Stickers transparentes,stickers-transparentes,S4,Stickers transparentes de alta calidad,,True
Stickers,Stickers cuadrados,stickers-cuadrados,S5,Stickers cuadrados de alta calidad,,True
Stickers,Stickers circulares,stickers-circulares,S6,Stickers circulares de alta calidad,,True
Stickers,Stickers rectangulares,stickers-rectangulares,S7,Stickers rectangulares de alta calidad,,True
Stickers,Stickers con esquinas redondeadas,stickers-con-esquinas-redondeadas,S8,Stickers con esquinas redondeadas de alta calidad,,True
